{
  "$schema":"https://json-schema.org/draft/2020-12/schema",
  "$id":"https://agentdesk.local/schema/envelope.json",
  "type":"object","additionalProperties":false,
  "required":["protocol_version","message_id","message_type","session_id","executor_id","actor","issued_at","expires_at","nonce","payload","signature"],
  "properties":{"protocol_version":{"type":"string","minLength":1},"message_id":{"type":"string","minLength":1},"message_type":{"type":"string","minLength":1},"session_id":{"type":"string","minLength":1},"executor_id":{"type":"string","minLength":1},"actor":{"type":"object","required":["subject","auth_method"],"additionalProperties":false,"properties":{"subject":{"type":"string","minLength":1},"auth_method":{"type":"string","minLength":1}}},"issued_at":{"type":"string","format":"date-time"},"expires_at":{"type":"string","format":"date-time"},"nonce":{"type":"string","minLength":16},"payload":{"type":"object"},"signature":{"type":"object","required":["algorithm","key_id","value"],"additionalProperties":false,"properties":{"algorithm":{"type":"string","minLength":1},"key_id":{"type":"string","minLength":1},"value":{"type":"string","minLength":1}}}}
}
