{"protocol_version":"0.1-draft","message_id":"m-1","message_type":"request.execute","session_id":"s-1","executor_id":"e-1","actor":{"subject":"agent","auth_method":"shared_key"},"issued_at":"2026-09-12T00:00:00Z","expires_at":"2026-09-12T00:01:00Z","nonce":"1234567890abcdef","payload":{"tool":"windows.system.info","contract_version":"0.1","arguments":{}},"signature":{"algorithm":"待定","key_id":"待定","value":"待定"}}
